{
  "symbols": ["BTCUSDT"],
  "timeframe": "1h",
  "date_from": "2021-07-01",
  "date_to": "2025-06-26",
  "initial_balance_usd": 10000.0,
  "total_wallet_exposure": 1.0,
  "strategy": {
    "entry_condition": {
      "ema_dist_pct": {
        "entry_ema_period": 11,
        "entry_ema_distance_pct": 0.0023
      }
    },
    "entries_algo": {
      "martingale": {
        "entry_grid_spacing_pct": 0.0016,
        "double_down_factor": 1.411
      }
    },
    "closes_algo": {
      "simple_grid": {
        "close_grid_spacing_pct": 0.0123,
        "close_grid_count": 4
      }
    },
    "initial_qty_pct": 0.0265,
    "sl_upnl_pct": -0.6294,
    "n_positions": 1,
    "parkinson_volatility_span": 21,
    "maker_fee_pct": 0.001,
    "time_based_unstuck_pct": 0.221,
    "time_based_unstuck_age": 102
  },
  "output": {"dir": "results"}
}
